{
  "$schema": "http://json-schema.org/draft-07/schema#",
  "$ref": "#/definitions/PaymentGateway",
  "definitions": {
    "PaymentGateway": {
      "type": "object",
      "example": {
        "paymentGatewayStatus": "reprehenderit exercitation voluptate sint nisi",
        "name": "pariatur in reprehenderit",
        "id": null,
        "systemCredential": "amet quis eu"
      },
      "additionalProperties": true,
      "required": [
        "paymentGatewayStatus",
        "name",
        "id"
      ],
      "properties": {
        "id": {
          "anyOf": [
            {
              "type": "string"
            },
            {
              "type": "null"
            }
          ]
        },
        "name": {
          "type": "string"
        },
        "paymentGatewayStatus": {
          "type": "string"
        },
        "paymentGatewayCommentText": {
          "type": "string"
        },
        "paymentGatewayProvider": {
          "type": "array",
          "items": {
            "anyOf": [
              {
                "type": "string"
              },
              {
                "type": "object",
                "additionalProperties": true,
                "required": [
                  "id",
                  "paymentGatewayProviderName"
                ],
                "properties": {
                  "id": {
                    "anyOf": [
                      {
                        "type": "string"
                      },
                      {
                        "type": "null"
                      }
                    ]
                  },
                  "apexAdapterClassName": {
                    "type": "string"
                  },
                  "paymentGatewayProviderCommentText": {
                    "type": "string"
                  },
                  "paymentGatewayProviderName": {
                    "type": "string"
                  },
                  "developerName": {
                    "type": "string"
                  },
                  "namespacePrefixText": {
                    "type": "string"
                  },
                  "auditInfo": {
                    "description": "Defines standard system audit fields available for most types",
                    "type": "object",
                    "example": {
                      "isDeleted": true,
                      "createdBy": "commodo minim dolore est",
                      "updatedBy": "dolor quis nulla",
                      "updatedDate": "1950-01-23T19:52:29.659Z",
                      "createdDate": "1950-01-23T19:52:29.659Z"
                    },
                    "additionalProperties": true,
                    "required": [
                      "isDeleted",
                      "createdBy",
                      "updatedBy",
                      "updatedDate",
                      "createdDate"
                    ],
                    "properties": {
                      "createdDate": {
                        "anyOf": [
                          {
                            "type": "string",
                            "format": "date-time"
                          },
                          {
                            "type": "null"
                          }
                        ],
                        "description": "Timestamp of when the entity was created"
                      },
                      "createdBy": {
                        "type": "string",
                        "description": "Identifies the system or user which created the entity"
                      },
                      "updatedDate": {
                        "anyOf": [
                          {
                            "type": "string",
                            "format": "date-time"
                          },
                          {
                            "type": "null"
                          }
                        ],
                        "description": "Timestamp of when the entity was last updated"
                      },
                      "updatedBy": {
                        "type": "string",
                        "description": "Identifies the system or user which last updated the entity"
                      },
                      "isDeleted": {
                        "anyOf": [
                          {
                            "type": "boolean"
                          },
                          {
                            "type": "null"
                          }
                        ],
                        "description": "Indicates whether or not the entity has been soft-deleted"
                      }
                    }
                  }
                }
              }
            ]
          }
        },
        "systemCredential": {
          "type": "string"
        },
        "auditInfo": {
          "description": "Defines standard system audit fields available for most types",
          "type": "object",
          "example": {
            "isDeleted": true,
            "createdBy": "commodo minim dolore est",
            "updatedBy": "dolor quis nulla",
            "updatedDate": "1950-01-23T19:52:29.659Z",
            "createdDate": "1950-01-23T19:52:29.659Z"
          },
          "additionalProperties": true,
          "required": [
            "isDeleted",
            "createdBy",
            "updatedBy",
            "updatedDate",
            "createdDate"
          ],
          "properties": {
            "createdDate": {
              "anyOf": [
                {
                  "type": "string",
                  "format": "date-time"
                },
                {
                  "type": "null"
                }
              ],
              "description": "Timestamp of when the entity was created"
            },
            "createdBy": {
              "type": "string",
              "description": "Identifies the system or user which created the entity"
            },
            "updatedDate": {
              "anyOf": [
                {
                  "type": "string",
                  "format": "date-time"
                },
                {
                  "type": "null"
                }
              ],
              "description": "Timestamp of when the entity was last updated"
            },
            "updatedBy": {
              "type": "string",
              "description": "Identifies the system or user which last updated the entity"
            },
            "isDeleted": {
              "anyOf": [
                {
                  "type": "boolean"
                },
                {
                  "type": "null"
                }
              ],
              "description": "Indicates whether or not the entity has been soft-deleted"
            }
          }
        }
      }
    }
  }
}